{
  "schema_version": "aig-resource/0.1-draft",
  "id": "demo-announcement-001",
  "title": "合成示例 维护公告更新",
  "publisher": { "id": "urn:aig:publisher:demo-announcements", "name": "Synthetic announcement publisher" },
  "source": { "system": "publisher-file-source", "record_id": "public-announcement-001", "public_url": "https://publisher.example.invalid/announcements/demo-001" },
  "revision": 2,
  "status": "published",
  "published_at": "2026-10-18T12:00:00Z",
  "updated_at": "2026-10-18T12:30:00Z",
  "synthetic": true,
  "representations": [
    { "media_type": "text/plain", "derivation": "original", "content_text": "【合成样例】维护计划更新：结束时间延至 03:30。\n  保留空白、换行与符号 A&B 🌐。  " }
  ]
}
